Title,URL,Timestamp,Article content
ZIPS Car Wash Takes Strategic Action to Strengthen Financial Foundation and Advance Operational Transformation,https://www.businesswire.com/news/home/20250205641535/en/ZIPS-Car-Wash-Takes-Strategic-Action-to-Strengthen-Financial-Foundation-and-Advance-Operational-Transformation,2025-02-06 01:21:00," PLANO, Texas--(BUSINESS WIRE)--Zips Car Wash, LLC (together with its affiliates, collectively “ZIPS” or the “Company”), one of the largest privately held car wash operators nationwide, announced that it has agreed to the terms of a restructuring plan (the “Plan”) with a group of its existing lenders that will strengthen its balance sheet and position the Company for stability and long-term growth. Through the Plan, ZIPS expects to reduce its debt obligations by approximately $279 million and secure $15 million of new capital to support the restructured business and future strategic initiatives.     To implement this transaction as efficiently as possible, and with the support of its existing lenders and equity holders, ZIPS filed voluntary chapter 11 cases in the U.S. Bankruptcy Court for the Northern District of Texas (the “Court”). The Company expects to emerge from chapter 11 quickly under the ownership of its existing lenders.   Importantly, ZIPS Car Wash, including its brands Rocket Express Car Wash and Jet Brite Car Wash, will operate in the ordinary course of business during ZIPS’ chapter 11 cases with no expected changes to their retail and membership proposition. As part of its financial restructuring process, ZIPS will continue to assess its operational footprint, and right-size and optimize its portfolio as part of its broader business transformation efforts.   “Today’s announcement represents a significant step forward in our efforts to position ZIPS with the necessary financial and operational foundation to drive long-term success,” said Kevin Nystrom, Chief Transformation Officer of ZIPS. “As we work with our financial partners to swiftly complete our financial restructuring, we remain wholly focused on supporting our teams and delivering the exceptional service our valued customers have come to expect.”   ZIPS has filed a number of customary “first day” motions with the Court to facilitate a smooth transition into chapter 11 and operate in the ordinary course, including continuing to pay employee wages and benefits, maintaining customer programs, and honoring obligations to vendors. To fund operations without disruption during the chapter 11 cases, ZIPS is seeking approval of a $30 million new money debtor-in-possession (“DIP”) financing package. Following Court approval, the Company anticipates the DIP financing will provide sufficient liquidity to support its operations during the chapter 11 process.   ZIPS expects to move through this process quickly and emerge from chapter 11 in approximately 2-3 months.   Additional information regarding the chapter 11 process is available at https://cases.ra.kroll.com/Zipscarwash. Stakeholders with questions can contact the Company’s claims agent, Kroll, by calling (888) 343-1371 (U.S. / Canada) or +1 (646) 876-2491 (International) or emailing ZipsCarWashInfo@ra.kroll.com.   Advisors  Kirkland & Ellis LLP and Gray Reed are serving as legal counsel, Evercore Group LLC is serving as investment banker, AlixPartners LLP is serving as financial and restructuring advisor, and C Street Advisory Group is serving as strategic communications advisor. ZIPS has retained Hilco Real Estate LLC to assist with lease negotiations.   About ZIPS Car Wash  ZIPS Car Wash, headquartered in Plano, Texas, is the largest privately held car wash operator nationwide, operating approximately 260 locations across 23 states under three brands: ZIPS Car Wash, Rocket Express Car Wash, and Jet Brite Car Wash. With 20 years of car washing experience, ZIPS prides itself on providing the highest quality express car wash in the industry. ZIPS uses the latest industry technology to provide a clean, dry, and shiny vehicle and exceptional customer experiences every day. The ZIPS team aims to positively impact the communities we live and serve in. To learn more visit www.zipscarwash.com.  "
Resumen: Datassential amplía datos globales del menú y ofertas limitadas en los 5 mercados europeos más grandes,https://www.businesswire.com/news/home/20250205096402/es,2025-02-06 01:20:00," CHICAGO--(BUSINESS WIRE)--Datassential, la plataforma líder de inteligencia en alimentos y bebidas que se especializa en conectar los puntos entre los consumidores y la industria, ha anunciado que ampliará su solución de inteligencia de ventas mundial de vanguardia, que ahora incluirá el seguimiento en profundidad de los menúes y las ofertas por tiempo limitado en los 5 grandes mercados europeos: Francia, Alemania, Italia, España y el Reino Unido. Esta mejora consolida aún más la posición de Datassential como el estándar de oro para promover el crecimiento del ecosistema de la restauración con información procesable.   Con una plataforma de prospección para el sector de la restauración, que rastrea más de 11 millones de operadores en más de 70 países y más de 100 atributos de operador, la solución de Datassential brinda herramientas incomparables para mejorar la productividad de las ventas y las tasas de éxito.   El comunicado en el idioma original es la versión oficial y autorizada del mismo. Esta traducción es solamente un medio de ayuda y deberá ser comparada con el texto en idioma original, que es la única versión del texto que tendrá validez legal.  "
Samenvatting: Datassential breidt gegevens van wereldwijde menu's en beperkte aanbiedingen uit naar de vijf grootste Europese markten,https://www.businesswire.com/news/home/20250205378627/nl,2025-02-06 01:19:00," CHICAGO--(BUSINESS WIRE)--Datassential, het toonaangevende platform voor informatie over voeding en dranken, dat de punten tussen consumenten en de branche verbindt, heeft aangekondigd dat het zijn geavanceerde wereldwijde sales intelligence-oplossing uitbreidt met het diepgaand volgen van menu's en beperkte aanbiedingen (LTO) in de vijf grootste markten van Europa: Frankrijk, Duitsland, Italië, Spanje en het Verenigd Koninkrijk. Deze uitbreiding versterkt de positie van Datassential als de gouden standaard om het foodservice-ecosysteem van bruikbare inzichten te voorzien.   Met een foodservice prospectieplatform dat meer dan 11 miljoen operators in ruim 70 landen en meer dan 100 operatorattributen volgt, biedt Datassential ongeëvenaarde tools om de verkoopproductiviteit en winstpercentages te verhogen.   Deze bekendmaking is officieel geldend in de originele brontaal. Vertalingen zijn slechts als leeshulp bedoeld en moeten worden vergeleken met de tekst in de brontaal, die als enige rechtsgeldig is.  "
Datassential étend son menu global et ses données d'offres à durée limitée aux 5 plus grands marchés d'Europe,https://www.businesswire.com/news/home/20250205263734/fr,2025-02-06 01:16:00," CHICAGO--(BUSINESS WIRE)--Datassential, la principale plateforme de renseignements dans le domaine de l'alimentation et des boissons, reliant les consommateurs et l'industrie, a annoncé l'expansion de sa solution d'intelligence commerciale mondiale de pointe pour inclure le suivi approfondi des menus et des offres à durée limitée (ODL) dans les cinq principaux marchés européens : la France, l'Allemagne, l'Italie, l'Espagne et le Royaume-Uni. Cette amélioration renforce encore davantage la position de Datassential comme référence incontournable pour fournir des informations utiles à l'écosystème de la restauration.     Avec une plateforme de prospection pour la restauration qui suit plus de 11 millions d'opérateurs dans plus de 70 pays et 100 attributs d'opérateurs, la solution de Datassential propose les meilleurs outils pour augmenter la productivité des ventes et les taux de réussite. L'ajout de données complètes des menus des marchés clés européens, permet aux utilisateurs d’accéder à des informations détaillées, garantissant ainsi des recommandations de menus plus intelligentes et basées sur des données, adaptées aux divers besoins des opérateurs.   « Comprendre les menus internationaux et les offres à durée limitée n'a jamais été aussi crucial pour nos clients souhaitant rester en tête dans le paysage compétitif de la restauration », a déclaré Jim Emling, PDG de Datassential. « En intégrant des informations détaillées sur les menus des plus grands marchés européens dans notre solution, nous permettons aux entreprises d'innover, d'impliquer efficacement les opérateurs et de stimuler la croissance avec une précision remarquable. »   Les clients auront désormais un accès direct à une base de données fiable sur les menus, offrant des opportunités remarquables d'étendre leur couverture mondiale. L'ajout du suivi des ODL et des nouveaux articles permet aux clients de découvrir des opportunités inexploitées et de rester en avance sur les tendances émergentes qui se développent au sein des grandes chaînes en France, au Royaume-Uni, en Espagne, et au-delà.   Les offres supplémentaires de Datassential reflètent son engagement constant à doter ses clients des informations dont ils ont besoin pour réussir dans un secteur en constante évolution. En permettant aux entreprises de bénéficier d'une couverture mondiale et d'informations précises, Datassential les aide à convertir les données en opportunités.   Pour plus d'informations sur la solution globale d'intelligence commerciale de Datassential, visitez le site : www.datassential.com.   À propos de Datassential   Datassential est la première plateforme mondiale de renseignements sur l'alimentation et les boissons qui fournit des conseils sur les tendances, des analyses comparatives de la concurrence et des renseignements sur les ventes. Grâce à une suite de solutions basées sur l'IA, une interface utilisateur intuitive et des données exclusives, l'écosystème de l'alimentation et des boissons s'appuie sur Datassential pour développer, commercialiser et vendre leurs produits avec plus d'efficacité. Fondée en 2001, Datassential fournit des informations et des renseignements commerciaux à des marques telles que Burger King, DoorDash, General Mills, Land O' Lakes, Pepsi, Starbucks, Target, et bien d'autres encore.   Le texte du communiqué issu d’une traduction ne doit d’aucune manière être considéré comme officiel. La seule version du communiqué qui fasse foi est celle du communiqué dans sa langue d’origine. La traduction devra toujours être confrontée au texte source, qui fera jurisprudence.  "
Bioceres Crop Solutions Updates Second Fiscal Quarter 2025 Expectations,https://www.businesswire.com/news/home/20250205832896/en/Bioceres-Crop-Solutions-Updates-Second-Fiscal-Quarter-2025-Expectations,2025-02-06 01:00:00," ROSARIO, Argentina--(BUSINESS WIRE)--Bioceres Crop Solutions Corp. (NASDAQ: BIOX) today provided preliminary revenues, gross profit and adjusted EBITDA for the fiscal second quarter, ended December 31, 2024.   Second quarter revenues are expected to be approximately $105 million, with gross profit of $45 million and adjusted EBITDA of $15 million. These results reflect challenging conditions in Argentina, which remains a decisive market for the financial performance of the company in the first half of the year. Farmer purchasing behavior in the country changed significantly compared to the prior year, driven by macroeconomic conditions and unfavorable weather. This, together with high channel inventories, led to lower crop protection and micro-beaded fertilizer sales.   “As referenced by agricultural input providers as well as distributors and equipment vendors in the marketplace, Argentina continued to face significant headwinds related to weather, farmer economics, and inventory overhang. While this environment has had a particularly negative effect on cyclical businesses such as micro-beaded fertilizers, we expect to continue to retain or gain market share in our most established product families. Structurally, we remain confident in the attractiveness of our unique and evolving portfolio of products and in our ability to deliver these solutions ourselves, or via our partners, to farmers globally. We look forward to providing further context on our earnings call, as well as discussing initiatives we are undertaking to mitigate these industry-wide challenges,” said Federico Trucco, CEO of Bioceres Crop Solutions.   The Company clarifies that the information provided in this document represents only an expectation, hypothetical data that by no means constitutes a promise of performance by the Company or its management. The estimates present involve market factors that are beyond the Company’s control and, therefore, can be subject to changes. The Company will provide further details in its upcoming earnings release. Bioceres Crop Solutions will release its second quarter 2025 earnings on Tuesday, February 11, 2025, after the stock market close, followed by a webcast conference call on Wednesday, February 12, 2025, at 8:30 a.m. ET.   About Bioceres Crop Solutions Corp.  Bioceres Crop Solutions Corp. (NASDAQ: BIOX) is a leader in the development and commercialization of productivity solutions designed to regenerate agricultural ecosystems while making crops more resilient to climate change. To do this, Bioceres’ solutions create economic incentives for farmers and other stakeholders to adopt environmentally friendlier production practices. The Company has a unique biotech platform with high-impact, patented technologies for seeds and microbial ag-inputs, as well as next generation crop nutrition and protection solutions.   Forward-Looking Statements  This communication includes “forward-looking statements” within the meaning of the “safe harbor” provisions of the United States Private Securities Litigation Reform Act of 1995. Forward-looking statements may be identified by the use of words such as “forecast,” “intend,” “seek,” “target,” “anticipate,” “believe,” “expect,” “estimate,” “plan,” “outlook,” and “project” and other similar expressions that predict or indicate future events or trends or that are not statements of historical matters. Such forward-looking statements include estimated financial data, and any such forward-looking statements involve risks, assumptions and uncertainties. These forward-looking statements include, but are not limited to, whether (i) the health and safety measures implemented to safeguard employees and assure business continuity will be successful and (ii) we will be able to coordinate efforts to ramp up inventories. Such forward-looking statements are based on management’s reasonable current assumptions, expectations, plans and forecasts regarding the company’s current or future results and future business and economic conditions more generally. Such forward-looking statements involve risks, uncertainties and other factors, which may cause the actual results, levels of activity, performance or achievement of the company to be materially different from any future results expressed or implied by such forward-looking statements, and there can be no assurance that actual results will not differ materially from management’s expectations or could affect the company’s ability to achieve its strategic goals, including the uncertainties relating to the other factors that are described in the sections entitled “Risk Factors” in the company's Securities and Exchange Commission filings updated from time to time. The preceding list is not intended to be an exhaustive list of all of our forward-looking statements. Therefore, you should not rely on any of these forward-looking statements as predictions of future events. All forward-looking statements contained in this release are qualified in their entirety by this cautionary statement. Forward-looking statements speak only as of the date they are or were made, and the company does not intend to update or otherwise revise the forward-looking statements to reflect events or circumstances after the date of this release or to reflect the occurrence of unanticipated events, except as required by law.   Use of non-IFRS financial information  The company supplements the use of IFRS financial measures with non-IFRS financial measures. The non-IFRS measures should not be considered in isolation or as a substitute for measures of performance prepared in accordance with IFRS and may be different from non-IFRS measures used by other companies. In addition, the non-IFRS measures are not based on any comprehensive set of accounting rules or principles. Non-IFRS measures have limitations in that they do not reflect all of the amounts associated with our results of operations as determined in accordance with IFRS.   This non-IFRS financial measures should only be used to evaluate the company’s results of operations in conjunction with the most comparable IFRS financial measures. In addition, other companies may report similarly titled measures, but calculate them differently, which reduces their usefulness as a comparative measure. Management utilizes these non-IFRS metrics as performance measures in evaluating and making operational decisions regarding our business.   Adjusted EBITDA  The company defines adjusted EBITDA as net income/(loss) exclusive of financial income/(costs), income tax benefit/(expense), depreciation, amortization, share-based compensation, and one-time transactional expenses.   Management believes that adjusted EBITDA provides useful supplemental information to investors about the company and its results. Adjusted EBITDA is among the measures used by the management team to evaluate the company’s financial and operating performance and make day-to-day financial and operating decisions. In addition, adjusted EBITDA and similarly titled measures are frequently used by competitors, rating agencies, securities analysts, investors and other parties to evaluate companies in the same industry. Management also believes that adjusted EBITDA is helpful to investors because it provides additional information about trends in the company’s core operating performance prior to considering the impact of capital structure, depreciation, amortization and taxation on results. Adjusted EBITDA should not be considered in isolation or as a substitute for other measures of financial performance reported in accordance with IFRS. Adjusted EBITDA has limitations as an analytical tool, including:    Adjusted EBITDA does not reflect changes in, including cash requirements for working capital needs or contractual commitments.    Adjusted EBITDA does not reflect financial expenses, or the cash requirements to service interest or principal payments on indebtedness, or interest income or other financial income.    Adjusted EBITDA does not reflect income tax expense or the cash requirements to pay income taxes.    Although depreciation and amortization are non-cash charges, the assets being depreciated or amortized often will need to be replaced in the future, and adjusted EBITDA does not reflect any cash requirements for these replacements.    Although share-based compensation is a non-cash charge, adjusted EBITDA does not consider the potentially dilutive impact of share-based compensation; and    Other companies may calculate adjusted EBITDA and similarly titled measures differently, limiting its usefulness as a comparative measure.    The company compensates for the inherent limitations associated with using adjusted EBITDA through disclosure of these limitations, presentation in the combined financial statements in accordance with IFRS and reconciliation of adjusted EBITDA to the most directly comparable IFRS measure, income/(loss) for the period or year.  "
Herron Todd White to build on success with Quadrant Private Equity Partnership,https://www.businesswire.com/news/home/20250205286410/en/Herron-Todd-White-to-build-on-success-with-Quadrant-Private-Equity-Partnership,2025-02-06 00:43:00," MELBOURNE, Australia--(BUSINESS WIRE)--Australia’s leading property advisory company, Herron Todd White (HTW), is pleased to announce the completion of its partnership with Quadrant Private Equity (QPE). The partnership will see QPE take a majority stake in HTW to support the business’ continuing growth and innovation strategy.   This alignment with QPE will strengthen HTW’s market position, expedite its growth and development of new products and services for clients across residential, commercial, government and agricultural sectors.   HTW currently operates 60 offices across Australia with more than 800 staff, building its success on a unique model and culture for almost 60 years to become Australia’s largest independent property valuation advisory group.   Gary Brinkworth, HTW Chief Executive, said this milestone would mark the beginning of a transformative era for HTW.   “The partnership will enable our business to expand our reach, enhance technology, and invest in our people’s capabilities to continue delivering the industry-leading services to our clients for which Herron Todd White is known,” Mr Brinkworth said.   Gareth Woodbridge, Managing Partner and Co-Head of the Buyout Strategy at QPE said: “We are excited to partner with HTW’s existing shareholders, employees and management team. HTW has a strong brand and market position with a reputation for delivering high-quality outcomes for its customers. We look forward to supporting HTW by investing in people, technology and data assets, and helping to expand its capabilities through acquisitions to accelerate the company’s growth plans.”   “As Herron Todd White embarks on this exciting new chapter, our goal remains to provide exceptional value to clients while staying true to the integrity, collaboration, and excellence that has defined our business for decades. This partnership with QPE strengthens our ability to seize new opportunities, expand reach, and drive sustainable growth.   “Our people, culture and values will always drive everything we do. This partnership with QPE reinforces the commitment to nurturing a culture of excellence, where team members feel empowered to deliver the highest service standards to clients. We’re proud to showcase the strength of our team and the meaningful impact it creates for clients and communities throughout Australia,” Mr Brinkworth said.   “We look forward to working with QPE to achieve our shared goals and continue to lead the property advisory industry with excellence, innovation, and dedication,” Mr Brinkworth said.   ENDS  About Herron Todd White  Led by CEO Gary Brinkworth, Herron Todd White is Australia’s largest independent property advisory firm, with over 800 staff and 60 locations nationwide. With a rich history spanning almost 60 years, HTW delivers a comprehensive range of valuation services and has earned a reputation as the trusted leader in the industry.   About Quadrant Private Equity  Quadrant Private Equity has been a leading private equity investor in Australia and New Zealand for 28 years. QPE is known for fostering meaningful growth partnerships and driving success for businesses aligned with its vision and values.  "
