Title,URL,Timestamp,Article content
Las audiencias finales sobre la disputa de propiedad intelectual de Aviator LLC se llevarán a cabo en el Tribunal de Apelaciones de Georgia el 14 de febrero,https://www.businesswire.com/news/home/20250205646563/es,2025-02-06 04:47:00," TIFLIS, Georgia--(BUSINESS WIRE)--Después de llegar a un acuerdo con Flutter Entertainment Plc, Aviator LLC sigue su batalla legal contra SPRIBE OU en relación con las infracciones a los derechos de propiedad intelectual y la propiedad legal de la marca Aviator.   Anteriormente, el Tribunal de Primera Instancia de Georgia había emitido un fallo invalidando las marcas comerciales de SPRIBE en Georgia, al haber concluido que SPRIBE había registrado marcas en disputa de mala fe y violando los derechos de autor de Aviator LLC.   Base factual  El logotipo de Aviator fue creado por el diseñador Giorgi Popiashvili en 2017 y fue utilizado por el operador de casino físico Aviator en Georgia desde 2018. Casino Aviator era propiedad de Teumraz Ugulava y funcionaba en las instalaciones del Hotel Stamba, que también pertenecía al señor Ugulava. El mismo logotipo se utilizaba para el streaming de la ruleta en línea en una de las plataformas de apuestas en línea más grandes de Georgia, llamada Adjarabet (www.adjarabet.com). En ese momento, esta plataforma también era propiedad del señor Ugulava, que estaba a cargo de Adjarabet a través de la empresa Aviator LLC, fundada en 2015.   En 2018, City Loft LLC, la empresa matriz de Casino Aviator y Adjarabet, registró 4 marcas comerciales de Aviator que aún siguen vigentes en Georgia. Puede accederse a los registros en los siguientes enlaces:   https://www.sakpatenti.gov.ge/en/search_engine/view/97902/3/  https://www.sakpatenti.gov.ge/en/search_engine/view/98969/3/  https://www.sakpatenti.gov.ge/en/search_engine/view/99435/3/  https://www.sakpatenti.gov.ge/en/search_engine/view/99436/3/  Spribe OU es la empresa fundada el 8 de agosto de 2018, después de solicitar el registro de las marcas comerciales mencionadas y mucho después de la creación del logotipo de Aviator.   En 2018, en cooperación con Adjarabet y con la asistencia financiera de Adjarabet, la flamante SPRIBE creó el juego crash, que se lanzó exclusivamente en la plataforma Adjarabet en 2019. Adjarabet le indicó a SPRIBE que utilizada el nombre Aviator para el juego y que además utilizara el gráfico de avión mencionado en el juego. Para ser más específico, SPRIBE ha creado software para el juego crash y ha utilizado el nombre y el avión que Adjarabet le cedió. Cuando esta imagen de marca (la marca comercial Aviator y la imagen del avión) se cedió a SPRIBE para que la utilice en el juego crash, fue activamente utilizada por Casino Aviator como su marca comercial y también en sus materiales de marketing.   Antes de la fundación de SPRIBE:    1.     La empresa operadora de Adjarabet se fundó en 2015, y su nombre comercial fue Aviator LLC desde ese momento.       2.     El logotipo de Aviator se creó en 2017, y sus derechos de autor pertenecían a la empresa matriz de Adjarabet y Casino Aviator.       3.    El casino físico ha estado operando bajo la marca comercial Aviator y utilizaba la imagen del avión en su marca y marketing.    4.     Adjarabet tenía una ruleta en línea por streaming en su sitio web, y en ella se utilizaba la marca Aviator.      Como se mencionó, SPRIBE creó el juego en cooperación con Adjarabet y con la asistencia financiera de Adjarabet. Como el juego estaba pensado para lanzarse exclusivamente en la plataforma de Adjarabet, Adjarabet le indicó a SPRIBE que utilice la imagen de marca de Casino Aviator (la marca comercial Aviator y la imagen del avión) en el juego. Esta imagen de marca estaba pensada para utilizarse exclusivamente en la plataforma de Adjarabet. Además, durante la creación del juego, Adjarabet le dio instrucciones a SPRIBE relacionadas con distintas funciones, características y el aspecto visual del juego.   Adjarabet nunca brindó su consentimiento y/o licencia, ni autorizó a SPRIBE para que utilice el nombre Aviator y/o el logotipo del avión con la marca comercial y/o su versión modificada en ningún lugar que no fuera su propia plataforma. Tampoco le cedió ningún derecho a SPRIBE para que registre el nombre Aviator o la imagen del avión en ninguna jurisdicción. SPRIBE ha estado utilizando la mencionada imagen del avión y el nombre Aviator para su juego crash en la plataforma de Adjarabet hasta el 24 de enero de 2024, cuando el Tribunal de Primera Instancia de Georgia promulgó el requerimiento judicial preliminar que prohíbe su uso hasta que se resuelva la disputa relacionada con la infracción a la propiedad intelectual entre Aviator LLC y SPRIBE OU.   El 3 de mayo de 2022, el señor Ugulava vendió Adjarabet a Flutter Entertainment Plc. El acuerdo de compraventa de esta transacción indicaba claramente que el mismo no incluía la adquisición de los derechos de la marca comercial Aviator, que se transfirió a su titular actual, Aviator LLC (404612610), que desde 2022 está a cargo de operaciones de juegos de tragamonedas bajo las marcas comerciales mencionadas y utiliza el logotipo para su negocio.   Pese a eso, SPRIBE solicitó distintas marcas comerciales en varias jurisdicciones incluida Georgia, el lugar donde se creó el juego.   Los fundamentos de la invalidación de estas marcas comerciales fueron el registro de mala fe y la violación del derecho de autor. El 20 de agosto de 2024, el Tribunal de Primera Instancia de Georgia invalidó las marcas comerciales de SPRIBE por estos dos motivos. A saber, el tribunal determinó que ambas marcas comerciales se registraron de mala fe y violaban el derecho de autor de Aviator LLC. La decisión del Tribunal de Apelaciones se espera para los próximos meses, y la audiencia final está fijada para el 14 de febrero de 2025.   La misma acción de invalidación actualmente está pendiente en la Oficina de Propiedad Intelectual de la Unión Europea en relación con la marca comercial que SPRIBE ha indicado en su informe. A saber, la marca comercial indicada fue registrada en 2020 por SPRIBE y es idéntica a la marca comercial que fue invalidada en Georgia. Puede acceder a esta información a través del siguiente enlace: https://euipo.europa.eu/eSearch/#details/trademarks/018817594  Aviator LLC busca litigar la marca comercial de SPRIBE en todo el mundo, incluida la Oficina de Propiedad Intelectual de la Unión Europea y el Reino Unido, con el objetivo de invalidar las marcas comerciales de SPRIBE con base en el registro de mala fe y la violación de los derechos de autor.   Para obtener más información sobre la disputa, comuníquese con Nikoloz Gogilidze, representante legal de Aviator LLC, a info.aviator@mikadze.ge.   El comunicado en el idioma original es la versión oficial y autorizada del mismo. Esta traducción es solamente un medio de ayuda y deberá ser comparada con el texto en idioma original, que es la única versión del texto que tendrá validez legal.  "
Le udienze finali relative alla causa riguardante l’IP intentata da Aviator LLC avranno luogo presso la Corte d’appello della Georgia il 14 febbraio,https://www.businesswire.com/news/home/20250205856755/it,2025-02-06 04:42:00," TBILISI, Georgia--(BUSINESS WIRE)--Dopo aver raggiunto una composizione con Flutter Entertainment Plc, Aviator LLC continua la causa intentata contro SPRIBE OU riguardante la violazione dell’IP e i diritti legali di proprietà del brand Aviator.   In precedenza, la Corte di prima istanza della Georgia aveva emesso una decisione che invalidava i marchi di fabbrica SPRIBE nella Georgia, avendo determinato che SPRIBE aveva registrato i marchi di fabbrica contestati in cattiva fede e violando i copyright di Aviator LLC.   Premessa fattuale  Il logo originale di Aviator è stato creato dal designer Giorgi Popiashvili nel 2017 ed è stato utilizzato da Aviator, operatore di Land Casino nella Georgia fin dal 2018. Casino Aviator era di proprietà di Teumraz Ugulava e operava presso lo Stamba Hotel, anch’esso di sua proprietà. Lo stesso logo veniva utilizzato per lo streaming del gioco della roulette praticato su una delle più grandi piattaforme di giochi d’azzardo online della Georgia, di nome Adjarabet (www.adjarabet.com). In quel periodo questa piattaforma era pure di proprietà di Teumraz Ugulava, che la gestiva tramite l’azienda Aviator LLC, fondata nel 2015.   Nel 2018 City Loft LLC, la capogruppo di Casino Aviator e Adjarabet, ha registrato quattro marchi di fabbrica Aviator ancora validi in Georgia. Le registrazioni sono accessibili attraverso i seguenti link:   https://www.sakpatenti.gov.ge/en/search_engine/view/97902/3/  https://www.sakpatenti.gov.ge/en/search_engine/view/98969/3/  https://www.sakpatenti.gov.ge/en/search_engine/view/99435/3/  https://www.sakpatenti.gov.ge/en/search_engine/view/99436/3/  Spribe OU è la società costituita l’8 agosto 2018, dopo che i marchi di fabbrica di cui sopra erano stati presentati per la registrazione e molto tempo dopo la creazione del logo Aviator.   Nel 2018, in cooperazione con Adjarabet e con l’assistenza finanziaria della stessa, la società di nuova costituzione SPRIBE ha creato il gioco “crash”, che è stato lanciato in esclusiva sulla piattaforma Adjarabet nel 2019. SPRIBE fu incaricata da Adjarabet di utilizzare il nome Aviator per il gioco e di utilizzare nel gioco l’immagine dell’aereo summenzionata. Per essere più specifici, SPRIBE ha creato il software per il gioco crash e ha utilizzato il nome e l’immagine dell’aeroplano ricevuti da Adjarabet. Quando tale brand (il marchio di fabbrica Aviator e l’immagine dell’aeroplano) è stato dato a SPRIBE per l’utilizzo nel gioco crash, è stato utilizzato attivamente da Casino Aviator come suo marchio di fabbrica nonché nel materiale di commercializzazione.   Prima ancora della fondazione di SPRIBE:     1.     La società operatrice di Adjarabet era stata fondata nel 2015 e da allora la sua ragione sociale è stata Aviator LLC.       2.     Il logo Aviator è stato creato nel 2017 e il copyright era di proprietà della capogruppo di Adjarabet e di Casino Aviator.       3.    Land Casino operava con il marchio di fabbrica Aviator e utilizzava l’immagine dell’aeroplano per il suo branding e marketing.    4.     Adjarabet rendeva possibile giocare alla roulette online in streaming tramite il suo sito web e a tale scopo veniva utilizzato il brand Aviator.      Come specificato, SPRIBE ha creato il gioco in cooperazione con Adjarabet e con l’assistenza finanziaria di quest’ultima. Poiché il gioco era previsto per essere lanciato esclusivamente sulla piattaforma di Adjarabet, quest’ultima ha incaricato SPRIBE di utilizzare il brand di Casino Aviator (il marchio di fabbrica Aviator e l’immagine dell’aeroplano) nel gioco. L’uso di questo brand era previsto esclusivamente sulla piattaforma di Adjarabet. Inoltre, durante la creazione del gioco Adjarabet ha incaricato SPRIBE di attuare varie funzioni, caratteristiche e aspetti visivi del gioco.   Adjarabet non ha mai dato alcun consenso e/o licenza né ha autorizzato SPRIBE a utilizzare la denominazione Aviator e/o il logo dell’aeroplano registrato come marchio di fabbrica e/o la sua versione modificata in nessuna sede diversa dalla propria piattaforma. Né ha concesso a SPRIBE alcun diritto a registrare la denominazione Aviator o l’immagine dell’aeroplano in qualsiasi paese. SPRIBE ha utilizzato tale immagine e la denominazione Aviator per il gioco crash sulla piattaforma Adjarabet fino al 24 gennaio 2024, quando la Corte di prima istanza della Georgia ha emesso l’ingiunzione preliminare che ne vieta l’uso finché la causa sulla violazione dell’IP tra Aviator LLC e SPRIBE OU non sarà risolta.   Il 3 maggio 2022 Teumraz Ugulava ha ceduto Adjarabet a Flutter Entertainment Plc. Il contratto di cessione e acquisto riguardante questa operazione afferma direttamente che il contratto stesso non includeva l’acquisizione di diritti sul marchio di fabbrica Aviator, che era stato trasferito all’attuale titolare Aviator LLC (404612610), che fin dal 2022 gestisce operazione relative a giochi con slot machine con tali marchi di fabbrica e utilizza il logo per la sua attività.   Nonostante ciò, SPRIBE ha applicato vari marchi di fabbrica in diversi paesi, compresa la Georgia, dove il gioco era stato creato.   I motivi per l’invalidamento di tali marchi di fabbrica consistono nella registrazione in cattiva fede e nella violazione del copyright. Il 20 agosto 2024 la Corte di prima istanza della Georgia ha invalidato i marchi di fabbrica di SPRIBE in base a entrambi i motivi. Ossia, il tribunale ha determinato che entrambi i marchi di fabbrica erano stati registrati in cattiva fede e violavano il copyright di Aviator LLC. Si prevede che la decisione della Corte di Appello sarà emessa nei prossimi mesi poiché l’udienza finale è fissata per il 14 febbraio 2025.   La stessa richiesta di invalidamento è attualmente in corso presso l’EUIPO per quanto riguarda il marchio di fabbrica che SPRIBE ha indicato nel suo report. Ossia, tale marchio di fabbrica è stato registrato nel 2020 da SPRIBE ed è identico a quello che è stato invalidato in Georgia. È possibile accedere a queste informazioni attraverso il seguente link: https://euipo.europa.eu/eSearch/#details/trademarks/018817594  Aviator LLC sta cercando di invalidare i marchi di fabbrica di SPRIBE in tutto il mondo, compresi l’EUIPO e il Regno Unito, sulla base sia della registrazione in cattiva fede sia della violazione del copyright.   Per maggiori informazioni su questa causa contattare il rappresentante legale di Aviator LLC, Nikoloz Gogilidze, all’indirizzo info.aviator@mikadze.ge.   Il testo originale del presente annuncio, redatto nella lingua di partenza, è la versione ufficiale che fa fede. Le traduzioni sono offerte unicamente per comodità del lettore e devono rinviare al testo in lingua originale, che è l'unico giuridicamente valido.  "
Laatste verhoren over geschil inzake intellectueel eigendom van Aviator LLC zullen op 14 februari worden gehouden in Georgische Hof van Beroep,https://www.businesswire.com/news/home/20250205991721/nl,2025-02-06 04:39:00," TBILISI, Georgië--(BUSINESS WIRE)--Na het treffen van een schikking met Flutter Entertainment Plc, blijft Aviator LLC procederen tegen SPRIBE OU met betrekking tot een inbreuk op intellectueel eigendom en aanspraken op wettelijk eigendom van het merk Aviator.   Het Georgische Gerecht van eerste aanleg had eerder een uitspraak gedaan die SPRIBE's handelsmerken in Georgië nietig verklaren en kwam tot de conclusie dat SPRIBE omstreden handelsmerken te kwader trouw registreerde en in strijd was met de auteursrechten van Aviator LLC.   Feitelijke achtergrond  Het originele Aviator-logo werd in 2017 ontworpen door de ontwerper de heer Giorgi Popiashvili en werd sinds 2018 gebruikt door de casino-exploitant Aviator in Georgië. Casino Aviator was eigendom van Teumraz Ugulava en werd uitgebaat in de gebouwen van het Stamba Hotel dat ook eigendom van hem was. Hetzelfde logo werd gebruikt voor het online uitzenden van roulette op één van de grootste online gokplatforms in Georgië, genaamd Adjarabet (www.adjarabet.com). Destijds was dit platform ook eigendom van de heer Ugulava, die Adjarabet exploiteerde onder het bedrijf Aviator LLC, dat in 2015 werd opgericht.   In 2018 registreerde City Loft LLC, het moederbedrijf van Casino Aviator en Adjarabet 4 Aviator-handelsmerken die in Georgië nog steeds van kracht zijn. Registraties zijn toegankelijk via de volgende links:   https://www.sakpatenti.gov.ge/en/search_engine/view/97902/3/  https://www.sakpatenti.gov.ge/en/search_engine/view/98969/3/  https://www.sakpatenti.gov.ge/en/search_engine/view/99435/3/  https://www.sakpatenti.gov.ge/en/search_engine/view/99436/3/  Spribe OU is het bedrijf dat in 8 augustus 2018 werd opgericht nadat de bovengenoemde handelsmerken werden ingediend ter registratie en lang nadat het Aviator-logo werd ontworpen.   In samenwerking met Adjarabet en met de financiële steun van Adjarabet, richtte het pas gevestigde SPRIBE het crash game in 2018 op dat exclusief werd geïntroduceerd op het Adjarabet-platform in 2019. Adjarabet droeg SPRIBE op om voor het spel de naam Aviator te gebruiken en het voornoemde vliegtuiglogo in het spel te gebruiken. Om precies te zijn, ontwikkelde SPRIBE software voor het crash game en gebruikte de naam en het vliegtuig dat aan hen door Adjarabet werd gegeven. Wanneer het voornoemde logo (handelsmerk Aviator en vliegtuiglogo) aan SPRIBE werd gegeven om in het crash game te worden gebruikt, werd het actief gebruikt door Casino Aviator als handelsmerk, maar ook in het marketingmateriaal.   Vóór SPRIBE zelfs werd opgericht:    1.     Operator company of Adjarabet was established in 2015 and its company name was Aviator LLC since then.       2.     The Aviator logo was created in 2017 and copyright belonged to the parent company of Adjarabet and casino Aviator.       3.    Land Casino has been operating under the TM Aviator and was using airplane image in its branding and marketing.    4.     Adjarabet was streaming online roulette through its website and Aviator branding was used for it.      Zoals vermeld, ontwikkelde SPRIBE het spel in samenwerking met Adjarabet en met de financiële steun van Adjarabet. Aangezien het spel uitsluitend was bedoeld voor Adjarabet's platform, kreeg SPRIBE van Adjarabet de opdracht om het Casino Aviator-logo (TM Aviator en vliegtuiglogo) in het spel te gebruiken. Dit logo was bedoeld om exclusief op Adjarabet's platform te worden gebruikt. Bovendien gaf Adjarabet tijdens de ontwikkeling van het spel instructies aan SPRIBE met betrekking tot diverse functies en visuele aspecten van het spel.   Adjarabet gaf nooit toestemming en/of een licentie of opdracht aan SPRIBE om de naam Aviator en/of het gedeponeerde vliegtuiglogo of zijn gewijzigde versie te gebruiken, behalve op zijn platform. Er werd ook nooit toestemming gegeven aan SPRIBE om de naam Aviator of het vliegtuiglogo in enig rechtsgebied te gebruiken. SPRIBE heeft het bovengenoemde vliegtuiglogo en de naam Aviator voor zijn crash game op het Adjarabet-platform tot 24 januari 2024 gebruikt wanneer het Georgische Gerecht van eerste aanleg de voorlopige uitspraak deed die het gebruik verbiedt tot het geschil over de inbreuk op het intellectueel eigendom tussen Aviator LLC en SPRIBE OU is opgelost.   Op 3 mei 2022 verkocht de heer Ugulava Adjarabet aan Flutter Entertainment Plc. In de verkoop- en aankoopovereenkomst van deze transactie stond letterlijk dat de overeenkomst niet de overname van rechten van het Aviator-handelsmerk bevatte, die werd overgedragen aan zijn huidige eigenaar Aviator LLC (404612610), die sinds 2022 gokautomaten uitbaat onder deze handelsmerken en het logo voor zijn activiteiten gebruikt.   Desondanks gebruikte SPRIBE meerdere handelsmerken in meerdere rechtsgebieden waaronder Georgië waar het spel werd ontwikkeld.   De redenen voor de nietigverklaring van deze handelsmerken waren registratie te kwader trouw en inbreuk op het auteursrecht. Op 20 augustus 2024 verklaarde het Georgische Gerecht van eerste aanleg de handelsmerken van SPRIBE nietig op basis van beide redenen. Het gerecht bepaalde namelijk dat beide handelsmerken te kwader trouw waren geregistreerd en een inbreuk waren op het auteursrecht van Aviator LLC. Het Hof van Beroep zal in de komende maanden uitspraak doen aangezien de laatste hoorzitting gepland staat op 14 februari 2025.   Dezelfde nietigverklaring is momenteel lopende in EUIPO met betrekking tot het handelsmerk dat SPRIBE in zijn rapport heeft vermeld. Het genoemde handelsmerk is namelijk in 2020 door SPRIBE geregistreerd en is gelijk aan het handelsmerk dat in Georgië werd nietig verklaard. U kunt deze informatie raadplegen via de volgende link: https://euipo.europa.eu/eSearch/#details/trademarks/018817594  Aviator LLC streeft wereldwijd SPRIBE's handelsmerk na waaronder EUIPO en het VK en beweert de handelsmerken van SPRIBE nietig te verklaren op basis van een registratie te kwader trouw en een inbreuk op het auteursrecht.   Voor meer informatie over dit geschil kunt u contact opnemen met de wettelijke vertegenwoordiger van Aviator LLC, Nikoloz Gogilidze op info.aviator@mikadze.ge.   Deze bekendmaking is officieel geldend in de originele brontaal. Vertalingen zijn slechts als leeshulp bedoeld en moeten worden vergeleken met de tekst in de brontaal, die als enige rechtsgeldig is.  "
